"Reinforcement learning has steadily improved and outperform human in lots of traditional games since the resurgence of deep neural network. However, these success is not easy to be copied to autonomous driving because the state spaces in real world are extreme complex and action spaces are continuous and fine control is required. Moreover, the autonomous driving vehicles must also keep functional safety under the complex environments. To deal with these challenges, we first adopt the deep deterministic policy gradient (DDPG) algorithm, which has the capacity to handle complex state and action spaces in continuous domain. We then choose The Open Racing Car Simulator (TORCS) as our environment to avoid physical damage. Meanwhile, we select a set of appropriate sensor information from TORCS and design our own rewarder. In order to fit DDPG algorithm to TORCS, we design our network architecture for both actor and critic inside DDPG paradigm. To demonstrate the effectiveness of our model, We evaluate on different modes in TORCS and show both quantitative and qualitative results.",0
"Since the resurgence of deep neural networks, reinforcement learning has made significant progress and surpassed human performance in many traditional games. However, transferring these achievements to autonomous driving is not easy due to the extreme complexity of real-world state spaces, continuous action spaces, and the need for precise control to maintain functional safety in complex environments. To tackle these challenges, we have employed the deep deterministic policy gradient (DDPG) algorithm, which can handle complex state and action spaces in the continuous domain. We have chosen The Open Racing Car Simulator (TORCS) as our environment to avoid physical damage, and we have carefully selected a set of appropriate sensor information from TORCS and developed our own rewarder. To adapt the DDPG algorithm to TORCS, we have designed network architectures for both the actor and critic within the DDPG paradigm. To demonstrate the effectiveness of our approach, we have evaluated it on different TORCS modes and presented both quantitative and qualitative results.",1
"The impact of softmax on the value function itself in reinforcement learning (RL) is often viewed as problematic because it leads to sub-optimal value (or Q) functions and interferes with the contraction properties of the Bellman operator. Surprisingly, despite these concerns, and independent of its effect on exploration, the softmax Bellman operator when combined with Deep Q-learning, leads to Q-functions with superior policies in practice, even outperforming its double Q-learning counterpart. To better understand how and why this occurs, we revisit theoretical properties of the softmax Bellman operator, and prove that $(i)$ it converges to the standard Bellman operator exponentially fast in the inverse temperature parameter, and $(ii)$ the distance of its Q function from the optimal one can be bounded. These alone do not explain its superior performance, so we also show that the softmax operator can reduce the overestimation error, which may give some insight into why a sub-optimal operator leads to better performance in the presence of value function approximation. A comparison among different Bellman operators is then presented, showing the trade-offs when selecting them.",0
"The use of softmax in reinforcement learning (RL) is often seen as problematic because it can result in suboptimal value functions and interfere with the contraction properties of the Bellman operator. Despite these concerns, when combined with Deep Q-learning, the softmax Bellman operator has been shown to produce superior policies in practice, even outperforming its double Q-learning counterpart. To better understand why this occurs, the theoretical properties of the softmax Bellman operator have been revisited, and it has been proven that it converges to the standard Bellman operator exponentially fast in the inverse temperature parameter, and the distance of its Q function from the optimal one can be bounded. However, these properties alone do not explain its superior performance. It has also been found that the softmax operator can reduce overestimation error, which may provide some insight into why a suboptimal operator leads to better performance when using value function approximation. A comparison of different Bellman operators is presented, showing the trade-offs involved in selecting them.",1
"In this paper, a review of model-free reinforcement learning for learning of dynamical systems in uncertain environments has discussed. For this purpose, the Markov Decision Process (MDP) will be reviewed. Furthermore, some learning algorithms such as Temporal Difference (TD) learning, Q-Learning, and Approximate Q-learning as model-free algorithms which constitute the main part of this article have been investigated, and benefits and drawbacks of each algorithm will be discussed. The discussed concepts in each section are explaining with details and examples.",0
"This paper provides an overview of model-free reinforcement learning in uncertain environments for learning dynamical systems. The Markov Decision Process (MDP) is reviewed for this purpose. Additionally, the main focus is on some learning algorithms, including Temporal Difference (TD) learning, Q-Learning, and Approximate Q-learning, as model-free algorithms. The advantages and disadvantages of each algorithm are also discussed. Furthermore, each section is explained in detail with examples.",1
"This paper provides a unifying view of a wide range of problems of interest in machine learning by framing them as the minimization of functionals defined on the space of probability measures. In particular, we show that generative adversarial networks, variational inference, and actor-critic methods in reinforcement learning can all be seen through the lens of our framework. We then discuss a generic optimization algorithm for our formulation, called probability functional descent (PFD), and show how this algorithm recovers existing methods developed independently in the settings mentioned earlier.",0
"By defining functionals on probability measures, this paper presents a comprehensive perspective on various machine learning problems. Our framework reveals that generative adversarial networks, variational inference, and actor-critic methods in reinforcement learning can all be interpreted within it. Additionally, we introduce a universal optimization algorithm, Probability Functional Descent (PFD), and demonstrate how it can recover methods previously developed in the mentioned contexts.",1
"Many continuous control tasks have easily formulated objectives, yet using them directly as a reward in reinforcement learning (RL) leads to suboptimal policies. Therefore, many classical control tasks guide RL training using complex rewards, which require tedious hand-tuning. We automate the reward search with AutoRL, an evolutionary layer over standard RL that treats reward tuning as hyperparameter optimization and trains a population of RL agents to find a reward that maximizes the task objective. AutoRL, evaluated on four Mujoco continuous control tasks over two RL algorithms, shows improvements over baselines, with the the biggest uplift for more complex tasks. The video can be found at: \url{https://youtu.be/svdaOFfQyC8}.",0
"Although continuous control tasks may have objectives that are easy to define, using them as a reward in reinforcement learning (RL) can result in suboptimal policies. As a result, many classical control tasks require complex rewards that need to be painstakingly hand-tuned to guide RL training. To simplify this process, we have developed AutoRL, an evolutionary layer that treats reward tuning as hyperparameter optimization and trains a population of RL agents to find a reward that maximizes the task objective. Our evaluation of AutoRL on four Mujoco continuous control tasks using two RL algorithms showed improvements over baselines, particularly for more complex tasks. A video of our work can be found at: \url{https://youtu.be/svdaOFfQyC8}.",1
"We assume that we are given a time series of data from a dynamical system and our task is to learn the flow map of the dynamical system. We present a collection of results on how to enforce constraints coming from the dynamical system in order to accelerate the training of deep neural networks to represent the flow map of the system as well as increase their predictive ability. In particular, we provide ways to enforce constraints during training for all three major modes of learning, namely supervised, unsupervised and reinforcement learning. In general, the dynamic constraints need to include terms which are analogous to memory terms in model reduction formalisms. Such memory terms act as a restoring force which corrects the errors committed by the learned flow map during prediction.   For supervised learning, the constraints are added to the objective function. For the case of unsupervised learning, in particular generative adversarial networks, the constraints are introduced by augmenting the input of the discriminator. Finally, for the case of reinforcement learning and in particular actor-critic methods, the constraints are added to the reward function. In addition, for the reinforcement learning case, we present a novel approach based on homotopy of the action-value function in order to stabilize and accelerate training. We use numerical results for the Lorenz system to illustrate the various constructions.",0
"Our objective is to learn the flow map of a given dynamical system using a time series of data. To enhance the predictive ability of deep neural networks and expedite their training to represent the system's flow map, we suggest enforcing constraints based on the dynamical system. To achieve this, we provide methods to enforce constraints during the three major modes of learning: supervised, unsupervised, and reinforcement learning. These dynamic constraints need to include memory terms that act as a restoring force to correct errors committed during prediction. We incorporate constraints in the objective function for supervised learning and augment the discriminator's input for unsupervised learning, particularly generative adversarial networks. For reinforcement learning, we add constraints to the reward function and introduce a new approach based on homotopy of the action-value function to stabilize and expedite training. We present numerical results for the Lorenz system to illustrate the various techniques.",1
"Model-agnostic meta-learning (MAML) is a meta-learning technique to train a model on a multitude of learning tasks in a way that primes the model for few-shot learning of new tasks. The MAML algorithm performs well on few-shot learning problems in classification, regression, and fine-tuning of policy gradients in reinforcement learning, but comes with the need for costly hyperparameter tuning for training stability. We address this shortcoming by introducing an extension to MAML, called Alpha MAML, to incorporate an online hyperparameter adaptation scheme that eliminates the need to tune meta-learning and learning rates. Our results with the Omniglot database demonstrate a substantial reduction in the need to tune MAML training hyperparameters and improvement to training stability with less sensitivity to hyperparameter choice.",0
"Model-agnostic meta-learning (MAML) is a technique that enables a model to be trained on multiple learning tasks, preparing it for the few-shot learning of new tasks. Although the MAML algorithm performs well on classification, regression, and fine-tuning of policy gradients in reinforcement learning, it requires costly hyperparameter tuning for training stability. To address this issue, we introduce a new extension to MAML known as Alpha MAML, which includes an online hyperparameter adaptation scheme that eliminates the need for meta-learning and learning rates tuning. Our experiments with the Omniglot database demonstrate a significant reduction in the requirement for MAML training hyperparameters tuning, and improved training stability with less sensitivity to hyperparameter selection.",1
"As global greenhouse gas emissions continue to rise, the use of stratospheric aerosol injection (SAI), a form of solar geoengineering, is increasingly considered in order to artificially mitigate climate change effects. However, initial research in simulation suggests that naive SAI can have catastrophic regional consequences, which may induce serious geostrategic conflicts. Current geo-engineering research treats SAI control in low-dimensional approximation only. We suggest treating SAI as a high-dimensional control problem, with policies trained according to a context-sensitive reward function within the Deep Reinforcement Learning (DRL) paradigm. In order to facilitate training in simulation, we suggest to emulate HadCM3, a widely used General Circulation Model, using deep learning techniques. We believe this is the first application of DRL to the climate sciences.",0
"The use of stratospheric aerosol injection (SAI) as a solar geoengineering solution is being considered to mitigate the effects of climate change in light of increasing global greenhouse gas emissions. However, initial simulations indicate that this approach can have serious regional consequences, leading to potential geostrategic conflicts. Current geo-engineering research focuses on low-dimensional SAI control, but we propose a high-dimensional control problem that utilizes deep reinforcement learning (DRL) to train policies based on a context-sensitive reward function. To facilitate simulation training, we suggest using deep learning techniques to emulate HadCM3, a widely used General Circulation Model, representing the first application of DRL to the climate sciences.",1
"Off-policy reinforcement learning with eligibility traces is challenging because of the discrepancy between target policy and behavior policy. One common approach is to measure the difference between two policies in a probabilistic way, such as importance sampling and tree-backup. However, existing off-policy learning methods based on probabilistic policy measurement are inefficient when utilizing traces under a greedy target policy, which is ineffective for control problems. The traces are cut immediately when a non-greedy action is taken, which may lose the advantage of eligibility traces and slow down the learning process. Alternatively, some non-probabilistic measurement methods such as General Q($\lambda$) and Naive Q($\lambda$) never cut traces, but face convergence problems in practice. To address the above issues, this paper introduces a new method named TBQ($\sigma$), which effectively unifies the tree-backup algorithm and Naive Q($\lambda$). By introducing a new parameter $\sigma$ to illustrate the \emph{degree} of utilizing traces, TBQ($\sigma$) creates an effective integration of TB($\lambda$) and Naive Q($\lambda$) and continuous role shift between them. The contraction property of TB($\sigma$) is theoretically analyzed for both policy evaluation and control settings. We also derive the online version of TBQ($\sigma$) and give the convergence proof. We empirically show that, for $\epsilon\in(0,1]$ in $\epsilon$-greedy policies, there exists some degree of utilizing traces for $\lambda\in[0,1]$, which can improve the efficiency in trace utilization for off-policy reinforcement learning, to both accelerate the learning process and improve the performance.",0
"The use of eligibility traces in off-policy reinforcement learning poses a challenge due to the mismatch between target policy and behavior policy. Various methods, including importance sampling and tree-backup, have been employed to measure policy differences in a probabilistic manner. However, these methods prove to be inefficient and ineffective for control problems when utilizing traces under a greedy target policy. On the other hand, non-probabilistic measurement methods, such as General Q($\lambda$) and Naive Q($\lambda$), never cut traces, but face convergence problems in practice. This paper proposes a new method called TBQ($\sigma$) that effectively combines the tree-backup algorithm and Naive Q($\lambda$) by introducing a new parameter $\sigma$ to illustrate the degree of utilizing traces. TBQ($\sigma$) unifies TB($\lambda$) and Naive Q($\lambda$) and allows for a continuous role shift between them, while maintaining the contraction property for both policy evaluation and control settings. The online version of TBQ($\sigma$) is derived and its convergence proof is established. Empirical results show that utilizing traces to a certain degree can improve the efficiency in off-policy reinforcement learning and accelerate the learning process while improving performance, particularly for $\epsilon$-greedy policies with $\lambda\in[0,1]$.",1
"Shaping in humans and animals has been shown to be a powerful tool for learning complex tasks as compared to learning in a randomized fashion. This makes the problem less complex and enables one to solve the easier sub task at hand first. Generating a curriculum for such guided learning involves subjecting the agent to easier goals first, and then gradually increasing their difficulty. This paper takes a similar direction and proposes a dual curriculum scheme for solving robotic manipulation tasks with sparse rewards, called MaMiC. It includes a macro curriculum scheme which divides the task into multiple sub-tasks followed by a micro curriculum scheme which enables the agent to learn between such discovered sub-tasks. We show how combining macro and micro curriculum strategies help in overcoming major exploratory constraints considered in robot manipulation tasks without having to engineer any complex rewards. We also illustrate the meaning of the individual curricula and how they can be used independently based on the task. The performance of such a dual curriculum scheme is analyzed on the Fetch environments.",0
"Learning through shaping has been proven to be a more effective method for tackling complex tasks, as opposed to randomized learning. This approach simplifies the problem, allowing for easier completion of sub-tasks. To create a guided learning curriculum, the agent is first subjected to simpler goals that gradually increase in difficulty. This paper introduces the MaMiC scheme, which utilizes a dual curriculum approach to solve robotic manipulation tasks with sparse rewards. The macro curriculum divides the task into sub-tasks, while the micro curriculum enables learning between these sub-tasks. By combining these strategies, MaMiC overcomes exploratory constraints in robot manipulation tasks without requiring complex rewards. The curricula can also be used independently based on the task. The performance of the dual curriculum is evaluated on Fetch environments.",1
"Recent work in reinforcement learning demonstrated that learning solely through self-play is not only possible, but could also result in novel strategies that humans never would have thought of. However, optimization methods cast as a game between two players require careful tuning to prevent suboptimal results. Hence, we look at random play as an alternative method. In this paper, we train a DQN agent to play Sungka, a two-player turn-based board game wherein the players compete to obtain more stones than the other. We show that even with purely random play, our training algorithm converges very fast and is stable. Moreover, we test our trained agent against several baselines and show its ability to consistently win against these.",0
"Recent research on reinforcement learning has shown that self-play can lead to the development of innovative strategies that humans may not have considered. However, when optimization methods are framed as a two-player game, careful calibration is necessary to avoid suboptimal outcomes. Consequently, we explore random play as an alternative approach. Our study involves training a DQN agent to play Sungka, a two-player board game where the goal is to acquire more stones than the opponent. We demonstrate that our training algorithm converges quickly and remains stable even with purely random play. Furthermore, we assess our agent's performance against various baselines and prove that it consistently outperforms them.",1
"Automated design of neural network architectures tailored for a specific task is an extremely promising, albeit inherently difficult, avenue to explore. While most results in this domain have been achieved on image classification and language modelling problems, here we concentrate on dense per-pixel tasks, in particular, semantic image segmentation using fully convolutional networks. In contrast to the aforementioned areas, the design choices of a fully convolutional network require several changes, ranging from the sort of operations that need to be used---e.g., dilated convolutions---to a solving of a more difficult optimisation problem. In this work, we are particularly interested in searching for high-performance compact segmentation architectures, able to run in real-time using limited resources. To achieve that, we intentionally over-parameterise the architecture during the training time via a set of auxiliary cells that provide an intermediate supervisory signal and can be omitted during the evaluation phase. The design of the auxiliary cell is emitted by a controller, a neural network with the fixed structure trained using reinforcement learning. More crucially, we demonstrate how to efficiently search for these architectures within limited time and computational budgets. In particular, we rely on a progressive strategy that terminates non-promising architectures from being further trained, and on Polyak averaging coupled with knowledge distillation to speed-up the convergence. Quantitatively, in 8 GPU-days our approach discovers a set of architectures performing on-par with state-of-the-art among compact models on the semantic segmentation, pose estimation and depth prediction tasks. Code will be made available here: https://github.com/drsleep/nas-segm-pytorch",0
"Exploring the avenue of automated design of neural network architectures tailored for specific tasks is highly promising, yet challenging. While previous studies have focused on image classification and language modelling problems, our research centers on dense per-pixel tasks, specifically semantic image segmentation through fully convolutional networks. Compared to previous areas, designing a fully convolutional network requires various changes, including the type of operations used, such as dilated convolutions, and solving more challenging optimization problems. Our main focus is to search for high-performance compact segmentation architectures that can run in real-time with limited resources. To achieve this, we intentionally over-parameterize the architecture during training with auxiliary cells that provide intermediate supervisory signals and can be disregarded during evaluation. The design of the auxiliary cell is generated by a controller, which is a neural network with a fixed structure trained using reinforcement learning. Our research demonstrates an efficient approach to searching for these architectures within limited time and computational budgets, using a progressive strategy to terminate non-promising architectures and Polyak averaging with knowledge distillation to hasten convergence. Our approach discovers a set of architectures that perform on-par with the state-of-the-art among compact models in semantic segmentation, pose estimation, and depth prediction tasks in just 8 GPU-days. We will make the code available in the following link: https://github.com/drsleep/nas-segm-pytorch.",1
"We consider a model-based approach to perform batch off-policy evaluation in reinforcement learning. Our method takes a mixture-of-experts approach to combine parametric and non-parametric models of the environment such that the final value estimate has the least expected error. We do so by first estimating the local accuracy of each model and then using a planner to select which model to use at every time step as to minimize the return error estimate along entire trajectories. Across a variety of domains, our mixture-based approach outperforms the individual models alone as well as state-of-the-art importance sampling-based estimators.",0
"In reinforcement learning, we adopt a model-centered strategy to execute batch off-policy evaluation. Our technique merges parametric and non-parametric models of the surroundings using a mixture-of-experts approach to obtain the final value estimate with minimal anticipated error. Initially, we assess the accuracy of each model locally and then apply a planner to determine the model to be used at each time step to minimize the return error estimate throughout trajectories. Our mixture-based method surpasses the individual models and importance sampling-based estimators in various domains.",1
