"Many real-time deep models trained for semantic segmentation produce inconsistent results when applied to a video sequence due to the lack of consideration for correlations between frames. Methods that do account for these correlations, such as those that use optical flow or extract frame representations with other frames, often result in inaccurate results or unbalanced latency. In this study, we introduce an approach that performs efficient semantic video segmentation on a per-frame basis during the inference process while explicitly considering temporal consistency between frames as an extra constraint during training. This embedding of temporal consistency into the segmentation network enables us to process each frame independently without additional computational cost or post-processing and improve temporal consistency. Additionally, we use compact models for real-time execution and have designed new knowledge distillation methods to narrow the performance gap between compact and large models. Our approach outperforms previous keyframe-based methods in benchmarks, including Cityscapes and Camvid, with a better trade-off between accuracy and inference speed while also improving temporal consistency compared to corresponding baselines that are trained independently. Our code is available at https://tinyurl.com/segment-video.",1
"We present a novel deep learning architecture for probabilistic future prediction from video. We predict the future semantics, geometry and motion of complex real-world urban scenes and use this representation to control an autonomous vehicle. This work is the first to jointly predict ego-motion, static scene, and the motion of dynamic agents in a probabilistic manner, which allows sampling consistent, highly probable futures from a compact latent space. Our model learns a representation from RGB video with a spatio-temporal convolutional module. The learned representation can be explicitly decoded to future semantic segmentation, depth, and optical flow, in addition to being an input to a learnt driving policy. To model the stochasticity of the future, we introduce a conditional variational approach which minimises the divergence between the present distribution (what could happen given what we have seen) and the future distribution (what we observe actually happens). During inference, diverse futures are generated by sampling from the present distribution.",0
"Our innovative deep learning architecture is designed to predict the future of complex real-world urban scenes in a probabilistic manner using video. We can anticipate the future semantics, geometry, and motion, which is valuable for controlling autonomous vehicles. Our approach is unique in that it is the first to predict ego-motion, static scene, and dynamic agents' motion concurrently using a compact latent space to produce consistent, highly likely futures. Our model uses spatio-temporal convolutional modules to learn a representation from RGB video, which can then be explicitly decoded to future semantic segmentation, depth, and optical flow. This representation is also utilized as an input for a learnt driving policy. To account for the stochastic nature of the future, we introduce a conditional variational technique that minimizes the gap between the present and future distributions. During inference, we generate diverse futures by sampling from the present distribution.",1
"The use of hand gestures can be a useful tool for many applications in the human-computer interaction community. In a broad range of areas hand gesture techniques can be applied specifically in sign language recognition, robotic surgery, etc. In the process of hand gesture recognition, proper detection, and tracking of the moving hand become challenging due to the varied shape and size of the hand. Here the objective is to track the movement of the hand irrespective of the shape, size, and color of the hand. And, for this, a motion template guided by optical flow (OFMT) is proposed. OFMT is a compact representation of the motion information of a gesture encoded into a single image. In the experimentation, different datasets using bare hand with an open palm, and folded palm wearing green-glove are used, and in both cases, we could generate the OFMT images with equal precision. Recently, deep network-based techniques have shown impressive improvements as compared to conventional hand-crafted feature-based techniques. Moreover, in the literature, it is seen that the use of different streams with informative input data helps to increase the performance in the recognition accuracy. This work basically proposes a two-stream fusion model for hand gesture recognition and a compact yet efficient motion template based on optical flow. Specifically, the two-stream network consists of two layers: a 3D convolutional neural network (C3D) that takes gesture videos as input and a 2D-CNN that takes OFMT images as input. C3D has shown its efficiency in capturing spatio-temporal information of a video. Whereas OFMT helps to eliminate irrelevant gestures providing additional motion information. Though each stream can work independently, they are combined with a fusion scheme to boost the recognition results. We have shown the efficiency of the proposed two-stream network on two databases.",0
"Hand gestures have many applications in human-computer interaction. These techniques can be used in various areas such as sign language recognition and robotic surgery. However, detecting and tracking the moving hand can be challenging due to the hand's varying shape and size. The objective is to track the hand's movement regardless of its shape, size, and color. To achieve this, a motion template guided by optical flow (OFMT) has been proposed. OFMT is a compact representation of the motion information of a gesture encoded into a single image. In experiments, different datasets using bare hands with an open or folded palm and a green-gloved hand were used, and OFMT images were generated with equal precision. Recent studies have shown that deep network-based techniques outperform conventional hand-crafted feature-based techniques. Using different streams with informative input data can improve recognition accuracy. This work proposes a two-stream fusion model for hand gesture recognition, including a compact yet efficient motion template based on optical flow. The two-stream network consists of a 3D convolutional neural network (C3D) that takes gesture videos as input and a 2D-CNN that takes OFMT images as input. C3D efficiently captures spatio-temporal information of a video, while OFMT eliminates irrelevant gestures and provides additional motion information. Although each stream can work independently, they are combined with a fusion scheme to boost the recognition results. The efficiency of the proposed two-stream network has been demonstrated on two databases.",1
"Optical flow is a crucial component of the feature space for early visual processing of dynamic scenes especially in new applications such as self-driving vehicles, drones and autonomous robots. The dynamic vision sensors are well suited for such applications because of their asynchronous, sparse and temporally precise representation of the visual dynamics. Many algorithms proposed for computing visual flow for these sensors suffer from the aperture problem as the direction of the estimated flow is governed by the curvature of the object rather than the true motion direction. Some methods that do overcome this problem by temporal windowing under-utilize the true precise temporal nature of the dynamic sensors. In this paper, we propose a novel multi-scale plane fitting based visual flow algorithm that is robust to the aperture problem and also computationally fast and efficient. Our algorithm performs well in many scenarios ranging from fixed camera recording simple geometric shapes to real world scenarios such as camera mounted on a moving car and can successfully perform event-by-event motion estimation of objects in the scene to allow for predictions of upto 500 ms i.e. equivalent to 10 to 25 frames with traditional cameras.",0
"Optical flow is an essential feature space component for early visual processing of dynamic scenes, particularly in innovative applications like autonomous robots, drones, and self-driving vehicles. Dynamic vision sensors are well-suited for these applications due to their asynchronous, sparse, and temporally precise visual dynamics representation. However, many algorithms for computing visual flow for these sensors face the aperture problem, where the estimated flow direction is determined by the object's curvature rather than the true motion direction. Some methods that overcome this problem underutilize the sensor's true temporal nature. This paper proposes a novel multi-scale plane fitting-based visual flow algorithm that is both robust to the aperture problem and computationally efficient. Our algorithm excels in several scenarios, including fixed camera recording of simple geometric shapes and real-world situations such as a camera mounted on a moving vehicle. It can successfully estimate event-by-event motion in the scene, allowing for predictions of up to 500 ms, equivalent to 10 to 25 frames with traditional cameras.",1
"Transferring existing image-based detectors to the video is non-trivial since the quality of frames is always deteriorated by part occlusion, rare pose, and motion blur. Previous approaches exploit to propagate and aggregate features across video frames by using optical flow-warping. However, directly applying image-level optical flow onto the high-level features might not establish accurate spatial correspondences. Therefore, a novel module called Learnable Spatio-Temporal Sampling (LSTS) has been proposed to learn semantic-level correspondences among adjacent frame features accurately. The sampled locations are first randomly initialized, then updated iteratively to find better spatial correspondences guided by detection supervision progressively. Besides, Sparsely Recursive Feature Updating (SRFU) module and Dense Feature Aggregation (DFA) module are also introduced to model temporal relations and enhance per-frame features, respectively. Without bells and whistles, the proposed method achieves state-of-the-art performance on the ImageNet VID dataset with less computational complexity and real-time speed. Code will be made available at https://github.com/jiangzhengkai/LSTS.",0
"It is difficult to transfer image-based detectors to video due to the degradation of frame quality caused by factors such as part occlusion, rare pose, and motion blur. Previous methods have used optical flow-warping to propagate and aggregate features across frames, but applying this directly to high-level features may not establish accurate spatial correspondences. To address this issue, a new module called Learnable Spatio-Temporal Sampling (LSTS) has been proposed to accurately learn semantic-level correspondences among adjacent frame features. The LSTS module utilizes detection supervision to iteratively update sampled locations for better spatial correspondences. Additionally, the proposed method includes the Sparsely Recursive Feature Updating (SRFU) module and Dense Feature Aggregation (DFA) module to model temporal relations and improve per-frame features, respectively. The method achieves state-of-the-art performance on the ImageNet VID dataset with real-time speed and less computational complexity. The code for this method will be available at https://github.com/jiangzhengkai/LSTS.",1
"Modern methods for counting people in crowded scenes rely on deep networks to estimate people densities in individual images. As such, only very few take advantage of temporal consistency in video sequences, and those that do only impose weak smoothness constraints across consecutive frames.   In this paper, we advocate estimating people flows across image locations between consecutive images and inferring the people densities from these flows instead of directly regressing. This enables us to impose much stronger constraints encoding the conservation of the number of people. As a result, it significantly boosts performance without requiring a more complex architecture. Furthermore, it also enables us to exploit the correlation between people flow and optical flow to further improve the results.   We will demonstrate that we consistently outperform state-of-the-art methods on five benchmark datasets.",0
"Crowd counting methods nowadays use deep networks to estimate people densities in individual images, but only a small number of them utilize the temporal consistency in video sequences. The few that do, only impose weak smoothness constraints across consecutive frames. This paper proposes estimating people flows between consecutive images and inferring people densities from these flows instead of direct regression. This approach enables stronger constraints encoding the conservation of the number of people, leading to improved performance without requiring a more complex architecture. Moreover, it leverages the correlation between people flow and optical flow to further enhance the results. The study shows consistent outperformance of this method over state-of-the-art approaches across five benchmark datasets.",1
"In this paper, we focus on a prediction-based novelty estimation strategy upon the deep reinforcement learning (DRL) framework, and present a flow-based intrinsic curiosity module (FICM) to exploit the prediction errors from optical flow estimation as exploration bonuses. We propose the concept of leveraging motion features captured between consecutive observations to evaluate the novelty of observations in an environment. FICM encourages a DRL agent to explore observations with unfamiliar motion features, and requires only two consecutive frames to obtain sufficient information when estimating the novelty. We evaluate our method and compare it with a number of existing methods on multiple benchmark environments, including Atari games, Super Mario Bros., and ViZDoom. We demonstrate that FICM is favorable to tasks or environments featuring moving objects, which allow FICM to utilize the motion features between consecutive observations. We further ablatively analyze the encoding efficiency of FICM, and discuss its applicable domains comprehensively.",0
"The focus of this paper is on a unique method for estimating novelty in deep reinforcement learning (DRL) called prediction-based novelty estimation. To accomplish this, a flow-based intrinsic curiosity module (FICM) is introduced, which uses prediction errors from optical flow estimation as exploration bonuses. The authors propose using motion features between consecutive observations to assess the novelty of observations in an environment. With FICM, a DRL agent is encouraged to explore observations with unfamiliar motion features, and only requires two consecutive frames to estimate the novelty adequately. The authors evaluate their method on various benchmark environments, including Atari games, Super Mario Bros., and ViZDoom, and demonstrate that FICM works best in environments with moving objects. They also analyze the encoding efficiency of FICM and examine its applicable domains in detail.",1
"The objective of this paper is to recover the original component signals from a mixture audio with the aid of visual cues of the sound sources. Such task is usually referred as visually guided sound source separation. The proposed Cascaded Opponent Filter (COF) framework consists of multiple stages, which recursively refine the source separation. A key element in COF is a novel opponent filter module that identifies and relocates residual components between sources. The system is guided by the appearance and motion of the source, and, for this purpose, we study different representations based on video frames, optical flows, dynamic images, and their combinations. Finally, we propose a Sound Source Location Masking (SSLM) technique, which, together with COF, produces a pixel level mask of the source location. The entire system is trained end-to-end using a large set of unlabelled videos. We compare COF with recent baselines and obtain the state-of-the-art performance in three challenging datasets (MUSIC, A-MUSIC, and A-NATURAL). Project page: https://ly-zhu.github.io/cof-net.",0
"The aim of this article is to use visual cues of sound sources to separate the original component signals from a mixed audio. This process is known as visually guided sound source separation. The proposed framework, Cascaded Opponent Filter (COF), is composed of several stages that progressively refine the source separation. The COF system relies on an innovative opponent filter module that identifies and relocates residual components between sources. To guide the system, we explore different representations based on video frames, optical flows, dynamic images, and their combinations. Additionally, we introduce a Sound Source Location Masking (SSLM) technique, which, in conjunction with COF, generates a pixel level mask of the source location. We train the entire system end-to-end using a substantial amount of unlabelled videos. We compare COF with recent baselines and achieve the best performance in three challenging datasets (MUSIC, A-MUSIC, and A-NATURAL). For further information, visit our project page at https://ly-zhu.github.io/cof-net.",1
"Many semantic events in team sport activities e.g. basketball often involve both group activities and the outcome (score or not). Motion patterns can be an effective means to identify different activities. Global and local motions have their respective emphasis on different activities, which are difficult to capture from the optical flow due to the mixture of global and local motions. Hence it calls for a more effective way to separate the global and local motions. When it comes to the specific case for basketball game analysis, the successful score for each round can be reliably detected by the appearance variation around the basket. Based on the observations, we propose a scheme to fuse global and local motion patterns (MPs) and key visual information (KVI) for semantic event recognition in basketball videos. Firstly, an algorithm is proposed to estimate the global motions from the mixed motions based on the intrinsic property of camera adjustments. And the local motions could be obtained from the mixed and global motions. Secondly, a two-stream 3D CNN framework is utilized for group activity recognition over the separated global and local motion patterns. Thirdly, the basket is detected and its appearance features are extracted through a CNN structure. The features are utilized to predict the success or failure. Finally, the group activity recognition and success/failure prediction results are integrated using the kronecker product for event recognition. Experiments on NCAA dataset demonstrate that the proposed method obtains state-of-the-art performance.",0
"Team sports like basketball involve various semantic events that combine group activities and outcome, often measured by the score. Motion patterns are useful for identifying these events, but it's challenging to distinguish between global and local motions using optical flow. To address this issue, we propose a scheme that combines global and local motion patterns with key visual information for semantic event recognition in basketball videos. First, we use an algorithm to estimate global motions from mixed motions, followed by extracting local motions. We then employ a two-stream 3D CNN framework for group activity recognition and detect the basket to predict success or failure using CNN features. Finally, we integrate group activity recognition and success/failure prediction results using the kronecker product for event recognition. Our experiments on the NCAA dataset show that our method outperforms other approaches.",1
"We present a new lightweight CNN-based algorithm for multi-frame optical flow estimation. Our solution introduces a double recurrence over spatial scale and time through repeated use of a generic ""STaR"" (SpatioTemporal Recurrent) cell. It includes (i) a temporal recurrence based on conveying learned features rather than optical flow estimates; (ii) an occlusion detection process which is coupled with optical flow estimation and therefore uses a very limited number of extra parameters. The resulting STaRFlow algorithm gives state-of-the-art performances on MPI Sintel and Kitti2015 and involves significantly less parameters than all other methods with comparable results.",0
"A novel CNN-based algorithm for estimating multi-frame optical flow is presented, which is lightweight and efficient. Our approach adopts a double recurrence strategy that operates over both spatial and temporal scales. This is achieved by utilizing a SpatioTemporal Recurrent (STaR) cell in a repetitive manner. The STaRFlow algorithm incorporates a temporal recurrence mechanism that leverages learned features instead of optical flow estimates. Furthermore, an occlusion detection process is integrated with optical flow estimation, requiring only a small number of additional parameters. The resulting approach achieves state-of-the-art performance on the MPI Sintel and Kitti2015 datasets, and requires significantly fewer parameters than other comparable methods.",1
"Shopping behaviour analysis through counting and tracking of people in shop-like environments offers valuable information for store operators and provides key insights in the stores layout (e.g. frequently visited spots). Instead of using extra staff for this, automated on-premise solutions are preferred. These automated systems should be cost-effective, preferably on lightweight embedded hardware, work in very challenging situations (e.g. handling occlusions) and preferably work real-time. We solve this challenge by implementing a real-time TensorRT optimized YOLOv3-based pedestrian detector, on a Jetson TX2 hardware platform. By combining the detector with a sparse optical flow tracker we assign a unique ID to each customer and tackle the problem of loosing partially occluded customers. Our detector-tracker based solution achieves an average precision of 81.59% at a processing speed of 10 FPS. Besides valuable statistics, heat maps of frequently visited spots are extracted and used as an overlay on the video stream.",0
"By utilizing people counting and tracking in shop-like environments, store operators can obtain valuable insights into their customers' shopping behavior and the store's layout, such as frequently visited areas. To avoid hiring additional staff, automated on-premise systems are preferred. These systems should be cost-effective, lightweight, work in challenging situations (such as dealing with occlusions), and operate in real-time. Our approach to this challenge involves implementing a real-time TensorRT-optimized YOLOv3-based pedestrian detector on a Jetson TX2 hardware platform. By combining the detector with a sparse optical flow tracker, we can assign a unique ID to each customer and address the issue of partially occluded customers. Our detector-tracker solution achieves an average precision of 81.59% at a processing speed of 10 FPS. In addition to providing valuable statistics, we also extract heat maps of frequently visited spots, which are overlaid on the video stream.",1
"Fast motion feedback is crucial in computer-aided surgery (CAS) on moving tissue. Image-assistance in safety-critical vision applications requires a dense tracking of tissue motion. This can be done using optical flow (OF). Accurate motion predictions at high processing rates lead to higher patient safety. Current deep learning OF models show the common speed vs. accuracy trade-off. To achieve high accuracy at high processing rates, we propose patient-specific fine-tuning of a fast model. This minimizes the domain gap between training and application data, while reducing the target domain to the capability of the lower complex, fast model. We propose to obtain training sequences pre-operatively in the operation room. We handle missing ground truth, by employing teacher-student learning. Using flow estimations from teacher model FlowNet2 we specialize a fast student model FlowNet2S on the patient-specific domain. Evaluation is performed on sequences from the Hamlyn dataset. Our student model shows very good performance after fine-tuning. Tracking accuracy is comparable to the teacher model at a speed up of factor six. Fine-tuning can be performed within minutes, making it feasible for the operation room. Our method allows to use a real-time capable model that was previously not suited for this task. This method is laying the path for improved patient-specific motion estimation in CAS.",0
