"Most previous works dealing with the problem of training on small datasets for action recognition tasks either rely on a large number of training samples or require pre-trained models from other large datasets to avoid overfitting. However, this approach is limited to organizations with strong computational capabilities. In this study, we aim to propose a data-efficient framework that can train the model from scratch on small datasets while achieving promising results. Our approach involves introducing a 3D central difference convolution operation and creating a novel C3D neural network-based two-stream framework that utilizes Rank Pooling RGB and Optical Flow. We validated our method on the action recognition track of the ECCV 2020 VIPriors challenges and achieved the 2nd place with 88.31% accuracy. Our findings demonstrate that our method can yield promising results without a pre-trained model on large scale datasets. We plan to release our code soon.",1
"Currently, the safety of people has become a very important problem in different places including subway station, universities, colleges, airport, shopping mall and square, city squares. Therefore, considering intelligence event detection systems is more and urgently required. The event detection method is developed to identify abnormal behavior intelligently, so public can take action as soon as possible to prevent unwanted activities. The problem is very challenging due to high crowd density in different areas. One of these issues is occlusion due to which individual tracking and analysis becomes impossible as shown in Fig. 1. Secondly, more challenging is the proper representation of individual behavior in the crowd. We consider a novel method to deal with these challenges. Considering the challenge of tracking, we partition complete frame into smaller patches, and extract motion pattern to demonstrate the motion in each individual patch. For this purpose, our work takes into account KLT corners as consolidated features to describe moving regions and track these features by considering optical flow method. To embed motion patterns, we develop and consider the distribution of all motion information in a patch as Gaussian distribution, and formulate parameters of Gaussian model as our motion pattern descriptor.",0
"The issue of people's safety has become a pressing concern in various public areas such as subway stations, airports, universities, colleges, shopping malls, and city squares. Therefore, it is essential to implement intelligent event detection systems to detect abnormal behavior and take immediate action to prevent unwanted activities. However, this task is challenging due to the high density of crowds in different areas. Two significant difficulties are occlusion, which makes it impossible to track individuals, and representing individual behavior in the crowd. To address these challenges, we propose a novel approach. We partition the complete frame into smaller patches and extract motion patterns in each patch using KLT corners as consolidated features and the optical flow method to track them. We then use the distribution of all motion information in a patch to formulate parameters of a Gaussian model as our motion pattern descriptor.",1
"Event cameras are bio-inspired sensors that differ from conventional frame cameras: Instead of capturing images at a fixed rate, they asynchronously measure per-pixel brightness changes, and output a stream of events that encode the time, location and sign of the brightness changes. Event cameras offer attractive properties compared to traditional cameras: high temporal resolution (in the order of microseconds), very high dynamic range (140 dB vs. 60 dB), low power consumption, and high pixel bandwidth (on the order of kHz) resulting in reduced motion blur. Hence, event cameras have a large potential for robotics and computer vision in challenging scenarios for traditional cameras, such as low-latency, high speed, and high dynamic range. However, novel methods are required to process the unconventional output of these sensors in order to unlock their potential. This paper provides a comprehensive overview of the emerging field of event-based vision, with a focus on the applications and the algorithms developed to unlock the outstanding properties of event cameras. We present event cameras from their working principle, the actual sensors that are available and the tasks that they have been used for, from low-level vision (feature detection and tracking, optic flow, etc.) to high-level vision (reconstruction, segmentation, recognition). We also discuss the techniques developed to process events, including learning-based techniques, as well as specialized processors for these novel sensors, such as spiking neural networks. Additionally, we highlight the challenges that remain to be tackled and the opportunities that lie ahead in the search for a more efficient, bio-inspired way for machines to perceive and interact with the world.",0
"Event cameras are sensors that are inspired by biology and are different from traditional frame cameras. They do not capture images at a fixed rate but rather measure changes in brightness asynchronously per pixel. This results in a stream of events that encode information about the time, location, and sign of the brightness changes. Event cameras have several advantages over traditional cameras, including high temporal resolution, very high dynamic range, low power consumption, and reduced motion blur. They are ideal for challenging scenarios such as low-latency, high speed, and high dynamic range, which traditional cameras struggle with. However, processing the output of event cameras requires novel methods to unlock their potential. This paper provides an overview of event-based vision, including the applications and algorithms used to unlock the properties of event cameras. It covers the working principle of event cameras, the available sensors, and the tasks they have been used for. The paper also discusses the techniques developed to process events, including learning-based techniques and specialized processors such as spiking neural networks. Finally, the paper highlights the challenges that remain and the opportunities that lie ahead in the search for a more efficient, bio-inspired way for machines to perceive and interact with the world.",1
"Efficiently modeling dynamic motion information in videos is crucial for action recognition task. Most state-of-the-art methods heavily rely on dense optical flow as motion representation. Although combining optical flow with RGB frames as input can achieve excellent recognition performance, the optical flow extraction is very time-consuming. This undoubtably will count against real-time action recognition. In this paper, we shed light on fast action recognition by lifting the reliance on optical flow. Our motivation lies in the observation that small displacements of motion boundaries are the most critical ingredients for distinguishing actions, so we design a novel motion cue called Persistence of Appearance (PA). In contrast to optical flow, our PA focuses more on distilling the motion information at boundaries. Also, it is more efficient by only accumulating pixel-wise differences in feature space, instead of using exhaustive patch-wise search of all the possible motion vectors. Our PA is over 1000x faster (8196fps vs. 8fps) than conventional optical flow in terms of motion modeling speed. To further aggregate the short-term dynamics in PA to long-term dynamics, we also devise a global temporal fusion strategy called Various-timescale Aggregation Pooling (VAP) that can adaptively model long-range temporal relationships across various timescales. We finally incorporate the proposed PA and VAP to form a unified framework called Persistent Appearance Network (PAN) with strong temporal modeling ability. Extensive experiments on six challenging action recognition benchmarks verify that our PAN outperforms recent state-of-the-art methods at low FLOPs. Codes and models are available at: https://github.com/zhang-can/PAN-PyTorch.",0
"It is crucial to efficiently model dynamic motion information in videos for action recognition. However, most current methods heavily rely on dense optical flow, which can be time-consuming. While combining optical flow with RGB frames can achieve excellent recognition performance, this approach is not suitable for real-time action recognition. In this study, we propose a novel motion cue called Persistence of Appearance (PA), which focuses on distilling motion information at boundaries and is more efficient than optical flow. Our PA is over 1000x faster than conventional optical flow in terms of motion modeling speed. To aggregate short-term dynamics in PA to long-term dynamics, we devise a global temporal fusion strategy called Various-timescale Aggregation Pooling (VAP), which can adaptively model long-range temporal relationships across various timescales. We incorporate PA and VAP into a unified framework called Persistent Appearance Network (PAN) with strong temporal modeling ability. Experiments on six challenging action recognition benchmarks demonstrate that our PAN outperforms recent state-of-the-art methods at low FLOPs. Codes and models are available at: https://github.com/zhang-can/PAN-PyTorch.",1
"Situational awareness and Indoor location tracking for firefighters is one of the tasks with paramount importance in search and rescue operations. For Indoor Positioning systems (IPS), GPS is not the best possible solution. There are few other techniques like dead reckoning, Wifi and bluetooth based triangulation, Structure from Motion (SFM) based scene reconstruction for Indoor positioning system. However due to high temperatures, the rapidly changing environment of fires, and low parallax in the thermal images, these techniques are not suitable for relaying the necessary information in a fire fighting environment needed to increase situational awareness in real time. In fire fighting environments, thermal imaging cameras are used due to smoke and low visibility hence obtaining relative orientation from the vanishing point estimation is very difficult. The following technique that is the content of this research implements a novel optical flow based video compass for orientation estimation and fused IMU data based activity recognition for IPS. This technique helps first responders to go into unprepared, unknown environments and still maintain situational awareness like the orientation and, position of the victim fire fighters.",0
"In search and rescue operations, situational awareness and indoor location tracking are of utmost importance for firefighters. Global Positioning System (GPS) is not the most effective solution for Indoor Positioning Systems (IPS). Alternative techniques such as dead reckoning, Wifi and Bluetooth-based triangulation, and Structure from Motion (SFM) based scene reconstruction are available for IPS. However, these techniques are unsuitable for fire-fighting environments due to the high temperatures, rapidly changing conditions, and low parallax in thermal images. Thermal imaging cameras are used in such environments, but obtaining relative orientation from vanishing point estimation is challenging because of smoke and low visibility. This research proposes a novel technique that uses optical flow-based video compass for orientation estimation and fused Inertial Measurement Unit (IMU) data-based activity recognition for IPS. This technique enables first responders to navigate unprepared environments and maintain situational awareness, including the orientation and position of victim firefighters.",1
"The objective of this paper is self-supervised learning from video, in particular for representations for action recognition. We make the following contributions: (i) We propose a new architecture and learning framework Memory-augmented Dense Predictive Coding (MemDPC) for the task. It is trained with a predictive attention mechanism over the set of compressed memories, such that any future states can always be constructed by a convex combination of the condense representations, allowing to make multiple hypotheses efficiently. (ii) We investigate visual-only self-supervised video representation learning from RGB frames, or from unsupervised optical flow, or both. (iii) We thoroughly evaluate the quality of learnt representation on four different downstream tasks: action recognition, video retrieval, learning with scarce annotations, and unintentional action classification. In all cases, we demonstrate state-of-the-art or comparable performance over other approaches with orders of magnitude fewer training data.",0
"The aim of this article is to explore self-supervised learning from video, with a focus on creating representations for action recognition. Our contributions are as follows: Firstly, we introduce a novel architecture and learning framework called Memory-augmented Dense Predictive Coding (MemDPC) for this task. This approach uses a predictive attention mechanism over compressed memories, enabling the efficient construction of multiple hypotheses for future states through a convex combination of condensed representations. Secondly, we examine visual-only self-supervised video representation learning from RGB frames, unsupervised optical flow, or both. Lastly, we conduct a comprehensive evaluation of the quality of the learned representations across four different downstream tasks, including action recognition, video retrieval, learning with limited annotations, and unintentional action classification. Our results demonstrate state-of-the-art or comparable performance compared to other approaches, with significantly less training data required.",1
"Human action recognition is regarded as a key cornerstone in domains such as surveillance or video understanding. Despite recent progress in the development of end-to-end solutions for video-based action recognition, achieving state-of-the-art performance still requires using auxiliary hand-crafted motion representations, e.g., optical flow, which are usually computationally demanding. In this work, we propose to use residual frames (i.e., differences between adjacent RGB frames) as an alternative ""lightweight"" motion representation, which carries salient motion information and is computationally efficient. In addition, we develop a new pseudo-3D convolution module which decouples 3D convolution into 2D and 1D convolution. The proposed module exploits residual information in the feature space to better structure motions, and is equipped with a self-attention mechanism that assists to recalibrate the appearance and motion features. Empirical results confirm the efficiency and effectiveness of residual frames as well as the proposed pseudo-3D convolution module.",0
"The recognition of human actions is considered crucial in fields such as video comprehension and surveillance. Although recent advancements have been made in creating end-to-end solutions for identifying actions in videos, achieving optimal performance often requires the use of manually crafted motion representations, like optical flow, which can be computationally intensive. This study proposes the use of residual frames (the contrast between adjacent RGB frames) as a more lightweight alternative for motion representation. These frames contain significant motion information and are less computationally demanding. Additionally, a new pseudo-3D convolution module is developed, which splits 3D convolution into 2D and 1D convolution. This module utilizes residual information in the feature space to better organize motions and is equipped with a self-attention mechanism to recalibrate appearance and motion features. Experimental results demonstrate the efficiency and effectiveness of residual frames and the proposed pseudo-3D convolution module.",1
"Dynamic Vision Sensors (DVSs) asynchronously stream events in correspondence of pixels subject to brightness changes. Differently from classic vision devices, they produce a sparse representation of the scene. Therefore, to apply standard computer vision algorithms, events need to be integrated into a frame or event-surface. This is usually attained through hand-crafted grids that reconstruct the frame using ad-hoc heuristics. In this paper, we propose Matrix-LSTM, a grid of Long Short-Term Memory (LSTM) cells that efficiently process events and learn end-to-end task-dependent event-surfaces. Compared to existing reconstruction approaches, our learned event-surface shows good flexibility and expressiveness on optical flow estimation on the MVSEC benchmark and it improves the state-of-the-art of event-based object classification on the N-Cars dataset.",0
"Dynamic Vision Sensors (DVSs) detect changes in pixel brightness and transmit events asynchronously. Unlike traditional vision devices, DVSs produce a sparse representation of the scene. To utilize standard computer vision algorithms, events must be integrated into a frame or event-surface. Typically, this involves using hand-crafted grids and ad-hoc heuristics to reconstruct the frame. In this paper, we propose Matrix-LSTM, a grid of Long Short-Term Memory (LSTM) cells that efficiently process events and learn task-dependent event-surfaces in an end-to-end manner. Our approach outperforms existing reconstruction methods on optical flow estimation in the MVSEC benchmark and improves the state-of-the-art of event-based object classification on the N-Cars dataset, while also providing greater flexibility and expressiveness.",1
"Particle Image Velocimetry (PIV) is a classical flow estimation problem which is widely considered and utilised, especially as a diagnostic tool in experimental fluid dynamics and the remote sensing of environmental flows. Recently, the development of deep learning based methods has inspired new approaches to tackle the PIV problem. These supervised learning based methods are driven by large volumes of data with ground truth training information. However, it is difficult to collect reliable ground truth data in large-scale, real-world scenarios. Although synthetic datasets can be used as alternatives, the gap between the training set-ups and real-world scenarios limits applicability. We present here what we believe to be the first work which takes an unsupervised learning based approach to tackle PIV problems. The proposed approach is inspired by classic optical flow methods. Instead of using ground truth data, we make use of photometric loss between two consecutive image frames, consistency loss in bidirectional flow estimates and spatial smoothness loss to construct the total unsupervised loss function. The approach shows significant potential and advantages for fluid flow estimation. Results presented here demonstrate that our method outputs competitive results compared with classical PIV methods as well as supervised learning based methods for a broad PIV dataset, and even outperforms these existing approaches in some difficult flow cases. Codes and trained models are available at https://github.com/erizmr/UnLiteFlowNet-PIV.",0
"PIV, a well-known flow estimation problem, is commonly used in experimental fluid dynamics and environmental flow remote sensing as a diagnostic tool. Recently, deep learning has led to new methods for tackling this problem. However, these supervised learning methods rely on large data volumes with ground truth training information, which is difficult to collect in real-world scenarios. Synthetic datasets can be used, but their limited applicability due to differences with real-world set-ups restricts their use. We present an unsupervised learning based approach, inspired by classic optical flow methods, which does not rely on ground truth data. Our approach uses photometric loss, consistency loss in bidirectional flow estimates, and spatial smoothness loss to construct the total unsupervised loss function. This approach shows significant potential and advantages for fluid flow estimation, as demonstrated by our competitive results with classical PIV methods and supervised learning based methods for a broad PIV dataset. In some difficult flow cases, our method even outperforms existing approaches. We have made our codes and trained models available at https://github.com/erizmr/UnLiteFlowNet-PIV.",1
"Many researches have been carried out for change detection using temporal SAR images. In this paper an algorithm for change detection using SAR videos has been proposed. There are various challenges related to SAR videos such as high level of speckle noise, rotation of SAR image frames of the video around a particular axis due to the circular movement of airborne vehicle, non-uniform back scattering of SAR pulses. Hence conventional change detection algorithms used for optical videos and SAR temporal images cannot be directly utilized for SAR videos. We propose an algorithm which is a combination of optical flow calculation using Lucas Kanade (LK) method and blob detection. The developed method follows a four steps approach: image filtering and enhancement, applying LK method, blob analysis and combining LK method with blob analysis. The performance of the developed approach was tested on SAR videos available on Sandia National Laboratories website and SAR videos generated by a SAR simulator.",0
"Numerous studies have been conducted to detect changes through the use of temporal SAR images. This paper introduces a new algorithm for change detection using SAR videos. However, SAR videos present several challenges, including a high level of speckle noise, rotation of SAR image frames due to the circular movement of the airborne vehicle, and non-uniform backscattering of SAR pulses. As a result, conventional change detection algorithms for optical videos and SAR temporal images cannot be directly applied to SAR videos. To address this, we propose a four-step approach combining optical flow calculation using the Lucas Kanade (LK) method with blob detection. The approach involves image filtering and enhancement, application of the LK method, blob analysis, and combining the LK method with blob analysis. We tested the performance of this approach using SAR videos from the Sandia National Laboratories website and SAR videos generated by a SAR simulator.",1
"Video super-resolution (VSR) aims to utilize multiple low-resolution frames to generate a high-resolution prediction for each frame. In this process, inter- and intra-frames are the key sources for exploiting temporal and spatial information. However, there are a couple of limitations for existing VSR methods. First, optical flow is often used to establish temporal correspondence. But flow estimation itself is error-prone and affects recovery results. Second, similar patterns existing in natural images are rarely exploited for the VSR task. Motivated by these findings, we propose a temporal multi-correspondence aggregation strategy to leverage similar patches across frames, and a cross-scale nonlocal-correspondence aggregation scheme to explore self-similarity of images across scales. Based on these two new modules, we build an effective multi-correspondence aggregation network (MuCAN) for VSR. Our method achieves state-of-the-art results on multiple benchmark datasets. Extensive experiments justify the effectiveness of our method.",0
"The objective of Video super-resolution (VSR) is to create high-resolution predictions for each frame by utilizing multiple low-resolution frames. To achieve this, temporal and spatial information from inter- and intra-frames is vital. However, current VSR techniques have some limitations. Firstly, optical flow is used to establish temporal correspondence, but its estimation is unreliable and can negatively impact the recovery outcome. Secondly, natural image patterns that could be beneficial for VSR are not often exploited. In light of these challenges, we propose a new method called the temporal multi-correspondence aggregation strategy, which employs similar patches across frames. Additionally, we use a cross-scale nonlocal-correspondence aggregation scheme to explore self-similarity of images across scales. Our approach, the multi-correspondence aggregation network (MuCAN), is built on these two new modules and has shown to produce superior results compared to existing methods when tested on various benchmark datasets. We have conducted extensive experiments that validate the effectiveness of our approach.",1
"Video style transfer techniques inspire many exciting applications on mobile devices. However, their efficiency and stability are still far from satisfactory. To boost the transfer stability across frames, optical flow is widely adopted, despite its high computational complexity, e.g. occupying over 97% inference time. This paper proposes to learn a lightweight video style transfer network via knowledge distillation paradigm. We adopt two teacher networks, one of which takes optical flow during inference while the other does not. The output difference between these two teacher networks highlights the improvements made by optical flow, which is then adopted to distill the target student network. Furthermore, a low-rank distillation loss is employed to stabilize the output of student network by mimicking the rank of input videos. Extensive experiments demonstrate that our student network without an optical flow module is still able to generate stable video and runs much faster than the teacher network.",0
