"The intensive care unit prefers opioids as the go-to medication for pain relief. However, the use of opioids must be monitored as underutilization may lead to untreated pain and poor patient outcomes, while overuse can cause multiple adverse effects. To address this, we developed a deep reinforcement learning-based framework for opioid dosing, which offers real-time and clinically relevant dosing recommendations that are personalized to the evolving pain and physiological condition of each patient. Our focus is on morphine, a commonly prescribed opioid, and we utilized retrospective data from the publicly available MIMIC-3 database to train and evaluate the model. Our findings show that personalized pain management interventions can be achieved using reinforcement learning and can aid decision-making in the intensive care setting.",1
"Machine learning has been widely applied to various applications, some of which involve training with privacy-sensitive data. A modest number of data breaches have been studied, including credit card information in natural language data and identities from face dataset. However, most of these studies focus on supervised learning models. As deep reinforcement learning (DRL) has been deployed in a number of real-world systems, such as indoor robot navigation, whether trained DRL policies can leak private information requires in-depth study. To explore such privacy breaches in general, we mainly propose two methods: environment dynamics search via genetic algorithm and candidate inference based on shadow policies. We conduct extensive experiments to demonstrate such privacy vulnerabilities in DRL under various settings. We leverage the proposed algorithms to infer floor plans from some trained Grid World navigation DRL agents with LiDAR perception. The proposed algorithm can correctly infer most of the floor plans and reaches an average recovery rate of 95.83% using policy gradient trained agents. In addition, we are able to recover the robot configuration in continuous control environments and an autonomous driving simulator with high accuracy. To the best of our knowledge, this is the first work to investigate privacy leakage in DRL settings and we show that DRL-based agents do potentially leak privacy-sensitive information from the trained policies.",0
"Various applications have widely utilized machine learning, some of which involve training with data that requires privacy protection. Although a few data breaches have been examined, such as credit card information in natural language data and identities from facial datasets, most studies have concentrated on supervised learning models. With the deployment of deep reinforcement learning (DRL) in actual systems, including indoor robot navigation, there is a need for a thorough investigation of whether trained DRL policies can leak sensitive information. To address this issue, we propose two primary methods: genetic algorithm-based environment dynamics search and shadow policy-based candidate inference. We perform extensive experiments to demonstrate privacy vulnerabilities in DRL under different circumstances. We employ the proposed algorithms to infer floor plans from some trained Grid World navigation DRL agents with LiDAR perception. The algorithm successfully infers most of the floor plans, with an average recovery rate of 95.83% using policy gradient-trained agents. Additionally, we accurately recover the robot configuration in continuous control environments and an autonomous driving simulator. This research is the first to investigate privacy leakage in DRL settings, demonstrating that DRL-based agents can potentially leak sensitive information from trained policies.",1
"This paper presents a novel approach to synthesize automatically age-progressed facial images in video sequences using Deep Reinforcement Learning. The proposed method models facial structures and the longitudinal face-aging process of given subjects coherently across video frames. The approach is optimized using a long-term reward, Reinforcement Learning function with deep feature extraction from Deep Convolutional Neural Network. Unlike previous age-progression methods that are only able to synthesize an aged likeness of a face from a single input image, the proposed approach is capable of age-progressing facial likenesses in videos with consistently synthesized facial features across frames. In addition, the deep reinforcement learning method guarantees preservation of the visual identity of input faces after age-progression. Results on videos of our new collected aging face AGFW-v2 database demonstrate the advantages of the proposed solution in terms of both quality of age-progressed faces, temporal smoothness, and cross-age face verification.",0
"Using Deep Reinforcement Learning, this paper introduces a new method for generating age-progressed facial images in video sequences automatically. By modeling facial structures and the aging process of subjects in a coherent manner across video frames, the proposed approach optimizes a Reinforcement Learning function with deep feature extraction from Deep Convolutional Neural Network using long-term rewards. Unlike previous methods that could only synthesize aged facial images from a single input image, this approach can consistently synthesize facial features across frames in videos. Furthermore, it ensures the preservation of visual identity after age-progression. Results from our new aging face AGFW-v2 database show the proposed solution's benefits in terms of quality, temporal smoothness, and cross-age face verification.",1
"In this paper, we point out a fundamental property of the objective in reinforcement learning, with which we can reformulate the policy gradient objective into a perceptron-like loss function, removing the need to distinguish between on and off policy training. Namely, we posit that it is sufficient to only update a policy $\pi$ for cases that satisfy the condition $A(\frac{\pi}{\mu}-1)\leq0$, where $A$ is the advantage, and $\mu$ is another policy. Furthermore, we show via theoretic derivation that a perceptron-like loss function matches the clipped surrogate objective for PPO. With our new formulation, the policies $\pi$ and $\mu$ can be arbitrarily apart in theory, effectively enabling off-policy training. To examine our derivations, we can combine the on-policy PPO clipped surrogate (which we show to be equivalent with one instance of the new reformation) with the off-policy IMPALA method. We first verify the combined method on the OpenAI Gym pendulum toy problem. Next, we use our method to train a quadrotor position controller in a simulator. Our trained policy is efficient and lightweight enough to perform in a low cost micro-controller at a minimum update rate of 500 Hz. For the quadrotor, we show two experiments to verify our method and demonstrate performance: 1) hovering at a fixed position, and 2) tracking along a specific trajectory. In preliminary trials, we are also able to apply the method to a real-world quadrotor.",0
"The objective of this research is to present a crucial characteristic of reinforcement learning. By doing so, we can modify the policy gradient objective and convert it into a perceptron-like loss function, eliminating the need for distinguishing between on and off policy training. Our hypothesis suggests that it is necessary to update the policy $\pi$ only for cases that fulfill the condition $A(\frac{\pi}{\mu}-1)\leq0$, where $A$ represents the advantage, and $\mu$ is another policy. Additionally, our theoretical derivation demonstrates that the perceptron-like loss function corresponds to the clipped surrogate objective for PPO. With this new formulation, policies $\pi$ and $\mu$ can be distant from each other, which facilitates off-policy training. We evaluate our theory by combining the on-policy PPO clipped surrogate with the off-policy IMPALA method and implementing the method on the OpenAI Gym pendulum toy problem and a quadrotor position controller in a simulator. Our trained policy is efficient and lightweight enough to perform on a low-cost micro-controller at a minimum update rate of 500 Hz. Furthermore, we demonstrate two experiments to verify our method for the quadrotor: hovering at a fixed position and tracking along a specific trajectory. In preliminary trials, we were also able to test the method on a real-world quadrotor.",1
"Model-free learning for multi-agent stochastic games is an active area of research. Existing reinforcement learning algorithms, however, are often restricted to zero-sum games, and are applicable only in small state-action spaces or other simplified settings. Here, we develop a new data efficient Deep-Q-learning methodology for model-free learning of Nash equilibria for general-sum stochastic games. The algorithm uses a local linear-quadratic expansion of the stochastic game, which leads to analytically solvable optimal actions. The expansion is parametrized by deep neural networks to give it sufficient flexibility to learn the environment without the need to experience all state-action pairs. We study symmetry properties of the algorithm stemming from label-invariant stochastic games and as a proof of concept, apply our algorithm to learning optimal trading strategies in competitive electronic markets.",0
"The study of model-free learning for multi-agent stochastic games is an active area of research. However, current reinforcement learning algorithms are often limited to zero-sum games and can only be used in simplified settings or small state-action spaces. In this study, we introduce a new Deep-Q-learning methodology that efficiently learns Nash equilibria for general-sum stochastic games without the need to experience all state-action pairs. Our algorithm is based on a local linear-quadratic expansion of the game, which allows for analytically solvable optimal actions. We use deep neural networks to parameterize the expansion and provide the algorithm with enough flexibility to learn the environment. Additionally, we investigate symmetry properties of the algorithm, which are derived from label-invariant stochastic games. As a proof of concept, we apply our algorithm to learn optimal trading strategies in competitive electronic markets.",1
"This paper addresses the scalability challenge of architecture search by formulating the task in a differentiable manner. Unlike conventional approaches of applying evolution or reinforcement learning over a discrete and non-differentiable search space, our method is based on the continuous relaxation of the architecture representation, allowing efficient search of the architecture using gradient descent. Extensive experiments on CIFAR-10, ImageNet, Penn Treebank and WikiText-2 show that our algorithm excels in discovering high-performance convolutional architectures for image classification and recurrent architectures for language modeling, while being orders of magnitude faster than state-of-the-art non-differentiable techniques. Our implementation has been made publicly available to facilitate further research on efficient architecture search algorithms.",0
"In this paper, the issue of scalability in architecture search is addressed through a differentiable approach. Rather than traditional methods that involve the use of evolution or reinforcement learning on a non-differentiable and discrete search space, our technique involves a continuous relaxation of the architecture representation. This allows for efficient architecture search using gradient descent. Our algorithm has been extensively tested on various datasets, including CIFAR-10, ImageNet, Penn Treebank, and WikiText-2, and has proven to be highly effective in discovering high-performance convolutional architectures for image classification and recurrent architectures for language modeling. Furthermore, our method is significantly faster than current non-differentiable techniques. We have made our implementation publicly available to encourage further research on efficient architecture search algorithms.",1
"Decomposition methods have been proposed to approximate solutions to large sequential decision making problems. In contexts where an agent interacts with multiple entities, utility decomposition can be used to separate the global objective into local tasks considering each individual entity independently. An arbitrator is then responsible for combining the individual utilities and selecting an action in real time to solve the global problem. Although these techniques can perform well empirically, they rely on strong assumptions of independence between the local tasks and sacrifice the optimality of the global solution. This paper proposes an approach that improves upon such approximate solutions by learning a correction term represented by a neural network. We demonstrate this approach on a fisheries management problem where multiple boats must coordinate to maximize their catch over time as well as on a pedestrian avoidance problem for autonomous driving. In each problem, decomposition methods can scale to multiple boats or pedestrians by using strategies involving one entity. We verify empirically that the proposed correction method significantly improves the decomposition method and outperforms a policy trained on the full scale problem without utility decomposition.",0
"To tackle large sequential decision making problems involving multiple entities, decomposition methods have been proposed to approximate solutions. Utility decomposition is utilized in such scenarios, which helps divide the global objective into local tasks, considering each entity individually. An arbitrator then combines the individual utilities and chooses an action in real time to solve the global problem. While these methods perform well, they rely on the assumption of independence between local tasks, which might compromise the optimality of the global solution. This paper introduces a novel approach, where a neural network learns a correction term to improve the accuracy of the approximation. The approach is tested on two different problems: fisheries management, where multiple boats must coordinate to maximize their catch over time, and pedestrian avoidance, a problem related to autonomous driving. The proposed correction method significantly improves the decomposition method and outperforms a policy trained on the full-scale problem without utility decomposition.",1
"Abstracting complex 3D shapes with parsimonious part-based representations has been a long standing goal in computer vision. This paper presents a learning-based solution to this problem which goes beyond the traditional 3D cuboid representation by exploiting superquadrics as atomic elements. We demonstrate that superquadrics lead to more expressive 3D scene parses while being easier to learn than 3D cuboid representations. Moreover, we provide an analytical solution to the Chamfer loss which avoids the need for computational expensive reinforcement learning or iterative prediction. Our model learns to parse 3D objects into consistent superquadric representations without supervision. Results on various ShapeNet categories as well as the SURREAL human body dataset demonstrate the flexibility of our model in capturing fine details and complex poses that could not have been modelled using cuboids.",0
"The goal of computer vision has long been to abstract complex 3D shapes into parsimonious part-based representations. This paper proposes a solution to this problem that utilizes superquadrics as atomic elements rather than the traditional 3D cuboid representation. Our research shows that superquadrics are more expressive and easier to learn than cuboid representations, and we have developed an analytical solution to the Chamfer loss that eliminates the need for computationally expensive reinforcement learning or iterative prediction. Our model can learn to parse 3D objects into consistent superquadric representations without supervision, and it has proven its flexibility in capturing fine details and complex poses that cannot be modeled with cuboids. We have demonstrated this through our experiments on various ShapeNet categories and the SURREAL human body dataset.",1
"Power system emergency control is generally regarded as the last safety net for grid security and resiliency. Existing emergency control schemes are usually designed off-line based on either the conceived ""worst"" case scenario or a few typical operation scenarios. These schemes are facing significant adaptiveness and robustness issues as increasing uncertainties and variations occur in modern electrical grids. To address these challenges, for the first time, this paper developed novel adaptive emergency control schemes using deep reinforcement learning (DRL), by leveraging the high-dimensional feature extraction and non-linear generalization capabilities of DRL for complex power systems. Furthermore, an open-source platform named RLGC has been designed for the first time to assist the development and benchmarking of DRL algorithms for power system control. Details of the platform and DRL-based emergency control schemes for generator dynamic braking and under-voltage load shedding are presented. Extensive case studies performed in both two-area four-machine system and IEEE 39-Bus system have demonstrated the excellent performance and robustness of the proposed schemes.",0
"The last resort for ensuring the security and resilience of the power grid is commonly known as power system emergency control. Currently, emergency control strategies are typically created offline and are based on either a few typical operation scenarios or the perceived worst-case scenario. However, these schemes face significant adaptiveness and robustness challenges due to the increased uncertainties and variations present in modern electrical grids. To tackle these issues, this paper introduces innovative adaptive emergency control schemes that utilize deep reinforcement learning (DRL). DRL's high-dimensional feature extraction and non-linear generalization capabilities are leveraged to address complex power systems. Additionally, an open-source platform called RLGC has been designed specifically for developing and benchmarking DRL algorithms for power system control. The paper provides detailed information on the platform and DRL-based emergency control schemes, including generator dynamic braking and under-voltage load shedding. The proposed schemes' superior performance and robustness were demonstrated through extensive case studies in both two-area four-machine systems and IEEE 39-Bus systems.",1
"How much does having visual priors about the world (e.g. the fact that the world is 3D) assist in learning to perform downstream motor tasks (e.g. delivering a package)? We study this question by integrating a generic perceptual skill set (e.g. a distance estimator, an edge detector, etc.) within a reinforcement learning framework--see Figure 1. This skill set (hereafter mid-level perception) provides the policy with a more processed state of the world compared to raw images.   We find that using a mid-level perception confers significant advantages over training end-to-end from scratch (i.e. not leveraging priors) in navigation-oriented tasks. Agents are able to generalize to situations where the from-scratch approach fails and training becomes significantly more sample efficient. However, we show that realizing these gains requires careful selection of the mid-level perceptual skills. Therefore, we refine our findings into an efficient max-coverage feature set that can be adopted in lieu of raw images. We perform our study in completely separate buildings for training and testing and compare against visually blind baseline policies and state-of-the-art feature learning methods.",0
"Our study aims to determine the extent to which visual priors, such as the world being three-dimensional, aid in learning downstream motor tasks like package delivery. We achieve this by incorporating a set of generic perceptual skills, such as an edge detector and distance estimator, into a reinforcement learning framework. This set of skills, referred to as mid-level perception, provides the policy with a more refined view of the world than raw images. Our research shows that using mid-level perception offers significant benefits over training from scratch, particularly in navigation-related tasks, enabling agents to generalize to scenarios where the from-scratch approach fails and reducing the amount of training required. However, we also discovered that the selection of mid-level perceptual skills is crucial to realizing these advantages. As a result, we have developed an efficient max-coverage feature set that can be used instead of raw images. Our study was conducted in separate buildings for training and testing and compared against visually impaired baseline policies and state-of-the-art feature learning techniques.",1
"An important facet of reinforcement learning (RL) has to do with how the agent goes about exploring the environment. Traditional exploration strategies typically focus on efficiency and ignore safety. However, for practical applications, ensuring safety of the agent during exploration is crucial since performing an unsafe action or reaching an unsafe state could result in irreversible damage to the agent. The main challenge of safe exploration is that characterizing the unsafe states and actions is difficult for large continuous state or action spaces and unknown environments. In this paper, we propose a novel approach to incorporate estimations of safety to guide exploration and policy search in deep reinforcement learning. By using a cost function to capture trajectory-based safety, our key idea is to formulate the state-action value function of this safety cost as a candidate Lyapunov function and extend control-theoretic results to approximate its derivative using online Gaussian Process (GP) estimation. We show how to use these statistical models to guide the agent in unknown environments to obtain high-performance control policies with provable stability certificates.",0
"Exploration in reinforcement learning (RL) is a crucial aspect that requires attention. The traditional approach focuses on efficiency and ignores safety, which is essential for practical applications. Unsafe actions or reaching hazardous states can cause irreversible harm to the agent. However, determining unsafe states and actions is challenging in large continuous state or action spaces and unknown environments. In this study, we propose a new method to incorporate safety estimates to guide exploration and policy search in deep RL. Our approach involves using a cost function to capture trajectory-based safety, where we formulate the state-action value function of this safety cost as a candidate Lyapunov function. To approximate its derivative, we extend control-theoretic outcomes using online Gaussian Process (GP) estimation. We demonstrate how these statistical models can guide the agent in unknown environments to obtain high-performance control policies with provable stability certificates.",1
"In decision making problems for continuous state and action spaces, linear dynamical models are widely employed. Specifically, policies for stochastic linear systems subject to quadratic cost functions capture a large number of applications in reinforcement learning. Selected randomized policies have been studied in the literature recently that address the trade-off between identification and control. However, little is known about policies based on bootstrapping observed states and actions. In this work, we show that bootstrap-based policies achieve a square root scaling of regret with respect to time. We also obtain results on the accuracy of learning the model's dynamics. Corroborative numerical analysis that illustrates the technical results is also provided.",0
"Linear dynamical models are commonly utilized in solving decision-making problems with continuous state and action spaces. Stochastic linear systems with quadratic cost functions are especially applicable in reinforcement learning. Randomized policies have been explored in literature to balance identification and control trade-offs. However, policies based on bootstrapping observed states and actions have not been thoroughly investigated. Our research demonstrates that bootstrap-based policies result in a regret scaling of square root with respect to time. Additionally, we present findings on the accuracy of learning the model's dynamics, along with numerical analysis to support our results.",1
"Deep neural networks have become commonplace in the domain of reinforcement learning, but are often expensive in terms of the number of parameters needed. While compressing deep neural networks has of late assumed great importance to overcome this drawback, little work has been done to address this problem in the context of reinforcement learning agents. This work aims at making first steps towards model compression in an RL agent. In particular, we compress networks to drastically reduce the number of parameters in them (to sizes less than 3% of their original size), further facilitated by applying a global max pool after the final convolution layer, and propose using Actor-Mimic in the context of compression. Finally, we show that this global max-pool allows for weakly supervised object localization, improving the ability to identify the agent's points of focus.",0
